00:19:17.967444 IP (tos 0x0, ttl 64, id 27993, offset 0, flags [DF], proto TCP (6), length 60)
    192.168.0.10.44576 > 192.168.0.9.22: Flags [S], cksum 0x36bc (correct), seq 31501630, win 29200, options [mss 1460,sackOK,TS val 1359975 ecr 0,nop,wscale 6], length 0
00:19:17.968082 IP (tos 0x0, ttl 64, id 27994, offset 0, flags [DF], proto TCP (6), length 52)
    192.168.0.10.44576 > 192.168.0.9.22: Flags [.], cksum 0x6ae6 (correct), ack 355374322, win 457, options [nop,nop,TS val 1359975 ecr 1360035], length 0
00:19:17.968754 IP (tos 0x0, ttl 64, id 27995, offset 0, flags [DF], proto TCP (6), length 95)
    192.168.0.10.44576 > 192.168.0.9.22: Flags [P.], cksum 0x0f5f (correct), seq 0:43, ack 1, win 457, options [nop,nop,TS val 1359975 ecr 1360035], length 43
00:19:17.977650 IP (tos 0x0, ttl 64, id 27996, offset 0, flags [DF], proto TCP (6), length 52)
    192.168.0.10.44576 > 192.168.0.9.22: Flags [.], cksum 0x6a8c (correct), ack 44, win 457, options [nop,nop,TS val 1359977 ecr 1360037], length 0
00:19:17.978395 IP (tos 0x0, ttl 64, id 27997, offset 0, flags [DF], proto TCP (6), length 52)
    192.168.0.10.44576 > 192.168.0.9.22: Flags [.], cksum 0x63e8 (correct), ack 1692, win 508, options [nop,nop,TS val 1359978 ecr 1360037], length 0
00:19:17.978740 IP (tos 0x0, ttl 64, id 27998, offset 0, flags [DF], proto TCP (6), length 2020)
    192.168.0.10.44576 > 192.168.0.9.22: Flags [P.], cksum 0x893a (incorrect -> 0xf877), seq 43:2011, ack 1692, win 508, options [nop,nop,TS val 1359978 ecr 1360037], length 1968
00:19:17.982653 IP (tos 0x0, ttl 64, id 28000, offset 0, flags [DF], proto TCP (6), length 100)
    192.168.0.10.44576 > 192.168.0.9.22: Flags [P.], cksum 0x819f (correct), seq 2011:2059, ack 1692, win 508, options [nop,nop,TS val 1359979 ecr 1360037], length 48
00:19:17.994973 IP (tos 0x0, ttl 64, id 28001, offset 0, flags [DF], proto TCP (6), length 68)
    192.168.0.10.44576 > 192.168.0.9.22: Flags [P.], cksum 0x5083 (correct), seq 2059:2075, ack 1972, win 553, options [nop,nop,TS val 1359982 ecr 1360040], length 16
00:19:18.031463 IP (tos 0x0, ttl 64, id 28002, offset 0, flags [DF], proto TCP (6), length 104)
    192.168.0.10.44576 > 192.168.0.9.22: Flags [P.], cksum 0x2bc7 (correct), seq 2075:2127, ack 1972, win 553, options [nop,nop,TS val 1359991 ecr 1360051], length 52
00:19:18.031982 IP (tos 0x0, ttl 64, id 28003, offset 0, flags [DF], proto TCP (6), length 120)
    192.168.0.10.44576 > 192.168.0.9.22: Flags [P.], cksum 0x3955 (correct), seq 2127:2195, ack 2024, win 553, options [nop,nop,TS val 1359991 ecr 1360051], length 68
00:19:18.098373 IP (tos 0x0, ttl 64, id 28004, offset 0, flags [DF], proto TCP (6), length 52)
    192.168.0.10.44576 > 192.168.0.9.22: Flags [.], cksum 0x59a0 (correct), ack 2076, win 553, options [nop,nop,TS val 1360008 ecr 1360058], length 0
00:19:18.978739 IP (tos 0x0, ttl 64, id 28005, offset 0, flags [DF], proto TCP (6), length 200)
    192.168.0.10.44576 > 192.168.0.9.22: Flags [P.], cksum 0xfeb7 (correct), seq 2195:2343, ack 2076, win 553, options [nop,nop,TS val 1360228 ecr 1360058], length 148
00:19:19.000451 IP (tos 0x0, ttl 64, id 28006, offset 0, flags [DF], proto TCP (6), length 52)
    192.168.0.10.44576 > 192.168.0.9.22: Flags [.], cksum 0x571c (correct), ack 2112, win 553, options [nop,nop,TS val 1360233 ecr 1360293], length 0
00:19:19.000798 IP (tos 0x0, ttl 64, id 28007, offset 0, flags [DF], proto TCP (6), length 172)
    192.168.0.10.44576 > 192.168.0.9.22: Flags [P.], cksum 0xb836 (correct), seq 2343:2463, ack 2112, win 553, options [nop,nop,TS val 1360233 ecr 1360293], length 120
00:19:19.177025 IP (tos 0x8, ttl 64, id 28008, offset 0, flags [DF], proto TCP (6), length 172)
    192.168.0.10.44576 > 192.168.0.9.22: Flags [P.], cksum 0xe3b2 (correct), seq 2463:2583, ack 2164, win 553, options [nop,nop,TS val 1360277 ecr 1360337], length 120
00:19:19.178983 IP (tos 0x8, ttl 64, id 28009, offset 0, flags [DF], proto TCP (6), length 52)
    192.168.0.10.44576 > 192.168.0.9.22: Flags [.], cksum 0x5533 (correct), ack 2272, win 553, options [nop,nop,TS val 1360278 ecr 136