01:43:30.185434 IP (tos 0x0, ttl 64, id 0, offset 0, flags [DF], proto TCP (6), length 60)
    192.168.0.10.22 > 192.168.0.9.37768: Flags [S.], cksum 0xa68c (correct), seq 1087932596, ack 3872092119, win 28960, options [mss 1460,sackOK,TS val 52845 ecr 4294913188,nop,wscale 6], length 0
01:43:30.185837 IP (tos 0x0, ttl 64, id 18136, offset 0, flags [DF], proto TCP (6), length 52)
    192.168.0.10.22 > 192.168.0.9.37768: Flags [.], cksum 0x4488 (correct), ack 44, win 453, options [nop,nop,TS val 52845 ecr 4294913188], length 0
01:43:30.190229 IP (tos 0x0, ttl 64, id 18137, offset 0, flags [DF], proto TCP (6), length 95)
    192.168.0.10.22 > 192.168.0.9.37768: Flags [P.], cksum 0xe8ff (correct), seq 1:44, ack 44, win 453, options [nop,nop,TS val 52846 ecr 4294913188], length 43
01:43:30.190608 IP (tos 0x0, ttl 64, id 18138, offset 0, flags [DF], proto TCP (6), length 1500)
    192.168.0.10.22 > 192.168.0.9.37768: Flags [.], cksum 0x805d (correct), seq 44:1492, ack 44, win 453, options [nop,nop,TS val 52846 ecr 4294913188], length 1448
01:43:30.191023 IP (tos 0x0, ttl 64, id 18139, offset 0, flags [DF], proto TCP (6), length 252)
    192.168.0.10.22 > 192.168.0.9.37768: Flags [P.], cksum 0x678d (correct), seq 1492:1692, ack 44, win 453, options [nop,nop,TS val 52846 ecr 4294913189], length 200
01:43:30.191030 IP (tos 0x0, ttl 64, id 18140, offset 0, flags [DF], proto TCP (6), length 52)
    192.168.0.10.22 > 192.168.0.9.37768: Flags [.], cksum 0x35fe (correct), ack 2012, win 514, options [nop,nop,TS val 52846 ecr 4294913189], length 0
01:43:30.195479 IP (tos 0x0, ttl 64, id 18141, offset 0, flags [DF], proto TCP (6), length 332)
    192.168.0.10.22 > 192.168.0.9.37768: Flags [P.], cksum 0xe233 (correct), seq 1692:1972, ack 2060, win 514, options [nop,nop,TS val 52847 ecr 4294913190], length 280
01:43:30.236252 IP (tos 0x0, ttl 64, id 18142, offset 0, flags [DF], proto TCP (6), length 52)
    192.168.0.10.22 > 192.168.0.9.37768: Flags [.], cksum 0x3498 (correct), ack 2076, win 514, options [nop,nop,TS val 52858 ecr 4294913191], length 0
01:43:30.236357 IP (tos 0x0, ttl 64, id 18143, offset 0, flags [DF], proto TCP (6), length 52)
    192.168.0.10.22 > 192.168.0.9.37768: Flags [.], cksum 0x345a (correct), ack 2128, win 514, options [nop,nop,TS val 52858 ecr 4294913201], length 0
01:43:30.236440 IP (tos 0x0, ttl 64, id 18144, offset 0, flags [DF], proto TCP (6), length 104)
    192.168.0.10.22 > 192.168.0.9.37768: Flags [P.], cksum 0x459a (correct), seq 1972:2024, ack 2128, win 514, options [nop,nop,TS val 52858 ecr 4294913201], length 52
01:43:30.252892 IP (tos 0x0, ttl 64, id 18145, offset 0, flags [DF], proto TCP (6), length 104)
    192.168.0.10.22 > 192.168.0.9.37768: Flags [P.], cksum 0x8153 (correct), seq 2024:2076, ack 2196, win 514, options [nop,nop,TS val 52862 ecr 4294913201], length 52
01:43:30.253446 IP (tos 0x0, ttl 64, id 18146, offset 0, flags [DF], proto TCP (6), length 376)
    192.168.0.10.22 > 192.168.0.9.37768: Flags [P.], cksum 0x52bc (correct), seq 2076:2400, ack 2568, win 560, options [nop,nop,TS val 52862 ecr 4294913205], length 324
01:43:30.256677 IP (tos 0x0, ttl 64, id 18147, offset 0, flags [DF], proto TCP (6), length 88)
    192.168.0.10.22 > 192.168.0.9.37768: Flags [P.], cksum 0x7c76 (correct), seq 2400:2436, ack 3212, win 605, options [nop,nop,TS val 52863 ecr 4294913206], length 36
01:43:30.295447 IP (tos 0x0, ttl 64, id 18148, offset 0, flags [DF], proto TCP (6), length 52)
    192.168.0.10.22 > 192.168.0.9.37768: Flags [.], cksum 0x2d67 (correct), ack 3332, win 605, options [nop,nop,TS val 52873 ecr 4294913206], length 0
01:43:30.430588 IP (tos 0x0, ttl 64, id 18149, offset 0, flags [DF], proto TCP (6), length 104)
    192.168.0.10.22 > 192.168.0.9.37768: Flags [P.], cksum 0xf96f (correct), seq 2436:2488, ack 3332, win 605, options [nop,nop,TS val 52906 ecr 4294913206], length 52
01:43:30.430851 IP (tos 0x0, ttl 64, id 18150, offset 0, flags [DF], proto TCP (6), length 52)
    192.168.0.10.22 > 192.168.0.9.37768: Flags [.], cksum 0x2c32 (correct), ack 3468, win 650, options [nop,nop,TS val 52906 ecr 4294913249], length 0
01:43:30.431194 IP (tos 0x8, ttl 64, id 18151, offset 0, flags [DF], proto TCP (6), length 124)
    192.168.0.10.22 > 192.168.0.9.37768: Flags [P.], cksum 0xe8cf (correct), seq 2488:2560, ack 3468, win 650, options [nop,nop,TS val 52906 ecr 4294913249], length 72
01:43:30.432746 IP (tos 0x8, ttl 64, id 18152, offset 0, flags [DF], proto TCP (6), length 88)
    192.168.0.10.22 > 192.168.0.9.37768: Flags [P.], cksum 0xf0d9 (correct), seq 2560:2596, ack 3468, win 650, options [nop,nop,TS val 52907 ecr 4294913249], length 36
01:43:30.433113 IP (tos 0x8, ttl 64, id 18153, offset 0, flags [DF], proto TCP (6), length 88)
    192.168.0.10.22 > 192.168.0.9.37768: Flags [P.], cksum 0x7c74 (correct), seq 2596:2632, ack 3536, win 650, options [nop,nop,TS val 52907 ecr 4294913250], length 36
01:43:30.434027 IP (tos 0x8, ttl 64, id 18154, offset 0, flags [DF], proto TCP (6), length 52)
    192.168.0.10.22 > 192.168.0.9.37768: Flags [.], cksum 0xf106 (correct), ack 18016, win 1103, options [nop,nop,TS val 52907 ecr 4294913250], length 0
01:43:30.434172 IP (tos 0x8, ttl 64, id 18155, offset 0, flags [DF], proto TCP (6), length 52)
    192.168.0.10.22 > 192.168.0.9.37768: Flags [.], cksum 0xab07 (correct), ack 35392, win 1646, options [nop,nop,TS val 52907 ecr 4294913250], length 0
01:43:30.434290 IP (tos 0x8, ttl 64, id 18156, offset 0, flags [DF], proto TCP (6), length 52)
    192.168.0.10.22 > 192.168.0.9.37768: Flags [.], cksum 0x6ade (correct), ack 51320, win 2143, options [nop,nop,TS val 52907 ecr 4294913250], length 0
01:43:30.434458 IP (tos 0x8, ttl 64, id 18157, offset 0, flags [DF], proto TCP (6), length 52)
    192.168.0.10.22 > 192.168.0.9.37768: Flags [.], cksum 0xdd3f (correct), ack 87520, win 2197, options [nop,nop,TS val 52907 ecr 4294913250], length 0
01:43:30.434758 IP (tos 0x8, ttl 64, id 18158, offset 0, flags [DF], proto TCP (6), length 52)
    192.168.0.10.22 > 192.168.0.9.37768: Flags [.], cksum 0x456a (correct), ack 126616, win 1970, options [nop,nop,TS val 52907 ecr 4294913250], length 0
01:43:30.435166 IP (tos 0x8, ttl 64, id 18159, offset 0, flags [DF], proto TCP (6), length 52)
    192.168.0.10.22 > 192.168.0.9.37768: Flags [.], cksum 0xa80c (correct), ack 167160, win 1711, options [nop,nop,TS val 52907 ecr 4294913250], length 0
01:43:30.435430 IP (tos 0x8, ttl 64, id 18160, offset 0, flags [DF], proto TCP (6), length 52)
    192.168.0.10.22 > 192.168.0.9.37768: Flags [.], cksum 0x0023 (correct), ack 210600, win 1255, options [nop,nop,TS val 52907 ecr 4294913251], length 0
01:43:30.435772 IP (tos 0x8, ttl 64, id 18161, offset 0, flags [DF], proto TCP (6), length 52)
    192.168.0.10.22 > 192.168.0.9.37768: Flags [.], cksum 0x56bf (correct), ack 254040, win 1178, options [nop,nop,TS val 52907 ecr 4294913251], length 0
01:43:30.436226 IP (tos 0x8, ttl 64, id 18162, offset 0, flags [DF], proto TCP (6), length 52)
    192.168.0.10.22 > 192.168.0.9.37768: Flags [.], cksum 0xa650 (correct), ack 297480, win 2903, options [nop,nop,TS val 52908 ecr 4294913251], length 0
01:43:30.436460 IP (tos 0x8, ttl 64, id 18163, offset 0, flags [DF], proto TCP (6), length 52)
    192.168.0.10.22 > 192.168.0.9.37768: Flags [.], cksum 0xf752 (correct), ack 340920, win 4260, options [nop,nop,TS val 52908 ecr 4294913251], length 0
01:43:30.436703 IP (tos 0x8, ttl 64, id 18164, offset 0, flags [DF], proto TCP (6), length 52)
    192.168.0.10.22 > 192.168.0.9.37768: Flags [.], cksum 0x45c0 (correct), ack 385808, win 4830, options [nop,nop,TS val 52908 ecr 4294913251], length 0
01:43:30.437477 IP (tos 0x8, ttl 64, id 18165, offset 0, flags [DF], proto TCP (6), length 52)
    192.168.0.10.22 > 192.168.0.9.37768: Flags [.], cksum 0x8b60 (correct), ack 433592, win 4757, options [nop,nop,TS val 52908 ecr 4294913251], length 0
01:43:30.437514 IP (tos 0x8, ttl 64, id 18166, offset 0, flags [DF], proto TCP (6), length 88)
    192.168.0.10.22 > 192.168.0.9.37768: Flags [P.], cksum 0xb1af (correct), seq 2632:2668, ack 433592, win 4757, options [nop,nop,TS val 52908 ecr 4294913251], length 36
01:43:30.437732 IP (tos 0x8, ttl 64, id 18167, offset 0, flags [DF], proto TCP (6), length 52)
    192.168.0.10.22 > 192.168.0.9.37768: Flags [.], cksum 0xcacb (correct), ack 482824, win 4789, options [nop,nop,TS val 52908 ecr 4294913251], length 0
01:43:30.438151 IP (tos 0x8, ttl 64, id 18168, offset 0, flags [DF], proto TCP (6), length 52)
    192.168.0.10.22 > 192.168.0.9.37768: Flags [.], cksum 0xffeb (correct), ack 534952, win 4596, options [nop,nop,TS val 52908 ecr 4294913251], length 0
01:43:30.438507 IP (tos 0x8, ttl 64, id 18169, offset 0, flags [DF], proto TCP (6), length 52)
    192.168.0.10.22 > 192.168.0.9.37768: Flags [.], cksum 0x2b3b (correct), ack 589976, win 4020, options [nop,nop,TS val 52908 ecr 4294913251], length 0
01:43:30.438851 IP (tos 0x8, ttl 64, id 18170, offset 0, flags [DF], proto TCP (6), length 52)
    192.168.0.10.22 > 192.168.0.9.37768: Flags [.], cksum 0x49b1 (correct), ack 647896, win 3837, options [nop,nop,TS val 52908 ecr 4294913251], length 0
01:43:30.438886 IP (tos 0x8, ttl 64, id 18171, offset 0, flags [DF], proto TCP (6), length 88)
    192.168.0.10.22 > 192.168.0.9.37768: Flags [P.], cksum 0x6819 (correct), seq 2668:2704, ack 647896, win 3837, options [nop,nop,TS val 52908 ecr 4294913251], length 36
01:43:30.439203 IP (tos 0x8, ttl 64, id 18172, offset 0, flags [DF], proto TCP (6), length 52)
    192.168.0.10.22 > 192.168.0.9.37768: Flags [.], cksum 0x5e78 (correct), ack 708712, win 3201, options [nop,nop,TS val 52908 ecr 4294913251], length 0
01:43:30.439614 IP (tos 0x8, ttl 64, id 18173, offset 0, flags [DF], proto TCP (6), length 52)
    192.168.0.10.22 > 192.168.0.9.37768: Flags [.], cksum 0x666a (correct), ack 772424, win 2989, options [nop,nop,TS val 52908 ecr 4294913252], length 0
01:43:30.440086 IP (tos 0x8, ttl 64, id 18174, offset 0, flags [DF], proto TCP (6), length 52)
    192.168.0.10.22 > 192.168.0.9.37768: Flags [.], cksum 0x57c6 (correct), ack 839032, win 5663, options [nop,nop,TS val 52909 ecr 4294913252], length 0
01:43:30.440378 IP (tos 0x8, ttl 64, id 18175, offset 0, flags [DF], proto TCP (6), length 52)
    192.168.0.10.22 > 192.168.0.9.37768: Flags [.], cksum 0x5149 (correct), ack 904192, win 7699, options [nop,nop,TS val 52909 ecr 4294913252], length 0
01:43:30.440521 IP (tos 0x8, ttl 64, id 18176, offset 0, flags [DF], proto TCP (6), length 52)
    192.168.0.10.22 > 192.168.0.9.37768: Flags [.], cksum 0x4826 (correct), ack 906460, win 7770, options [nop,nop,TS val 52909 ecr 4294913252], length 0
01:43:30.440619 IP (tos 0x8, ttl 64, id 18177, offset 0, flags [DF], proto TCP (6), length 88)
    192.168.0.10.22 > 192.168.0.9.37768: Flags [P.], cksum 0x9ff0 (correct), seq 2704:2740, ack 906460, win 7770, options [nop,nop,TS val 52909 ecr 4294913252], length 36
01:43:30.441309 IP (tos 0x8, ttl 64, id 18178, offset 0, flags [DF], proto TCP (6), length 88)
    192.168.0.10.22 > 192.168.0.9.37768: Flags [P.], cksum 0x41d8 (correct), seq 2740:2776, ack 906460, win 7770, options [nop,nop,TS val 52909 ecr 4294913252], length 36
01:43:30.442176 IP (tos 0x8, ttl 64, id 18179, offset 0, flags [DF], proto TCP (6), length 88)
    192.168.0.10.22 > 192.168.0.9.37768: Flags [P.], cksum 0xeb22 (correct), seq 2776:2812, ack 906460, win 7770, options [nop,nop,TS val 52909 ecr 4294913252], length 36
01:43:30.442900 IP (tos 0x8, ttl 64, id 18180, offset 0, flags [DF], proto TCP (6), length 88)
    192.168.0.10.22 > 192.168.0.9.37768: Flags [P.], cksum 0xf409 (correct), seq 2812:2848, ack 906460, win 7770, options [nop,nop,TS val 52909 ecr 4294913252], length 36
01:43:30.443615 IP (tos 0x8, ttl 64, id 18181, offset 0, flags [DF], proto TCP (6), length 88)
    192.168.0.10.22 > 192.168.0.9.37768: Flags [P.], cksum 0x0217 (correct), seq 2848:2884, ack 906460, win 7770, options [nop,nop,TS val 52909 ecr 4294913252], length 36
01:43:30.444269 IP (tos 0x8, ttl 64, id 18182, offset 0, flags [DF], proto TCP (6), length 88)
    192.168.0.10.22 > 192.168.0.9.37768: Flags [P.], cksum 0x3330 (correct), seq 2884:2920, ack 906460, win 7770, options [nop,nop,TS val 52910 ecr 4294913252], length 36
01:43:30.444332 IP (tos 0x8, ttl 64, id 18183, offset 0, flags [DF], proto TCP (6), length 88)
    192.168.0.10.22 > 192.168.0.9.37768: Flags [P.], cksum 0x93d3 (correct), seq 2920:2956, ack 906460, win 7770, options [nop,nop,TS val 52910 ecr 4294913252], length 36
01:43:30.444634 IP (tos 0x8, ttl 64, id 18184, offset 0, flags [DF], proto TCP (6), length 176)
    192.168.0.10.22 > 192.168.0.9.37768: Flags [P.], cksum 0xe55e (correct), seq 2956:3080, ack 906496, win 7770, options [nop,nop,TS val 52910 ecr 4294913253], length 124
01:43:30.444966 IP (tos 0x8, ttl 64, id 18185, offset 0, flags [DF], proto TCP (6), length 52)
    192.168.0.10.22 > 192.168.0.9.37768: Flags [.], cksum 0x461f (correct), ack 906601, win 7770, options [nop,nop,TS val 52910 ecr 4294913253], length 0
01:43:30.446473 IP (tos 0x8, ttl 64, id 18186, offset 0, flags [DF], proto TCP (6), length 52)
    192.168.0.10.22 > 192.168.0.9.37768: Flags [F.], cksum 0x461e (correct), seq 3080, ack 906601, win 7770, options [nop,nop,TS val 52910 ecr 4294913253], length 0
01:43:30.448228 IP (tos 0x0, ttl 64, id 0, offset 0, flags [DF], proto TCP (6), length 60)
    192.168.0.16.22 > 192.168.0.9.58022: Flags [S.], cksum 0x94f2 (correct), seq 1131134371, ack 4194824465, win 28960, options [mss 1460,sackOK,TS val 50344 ecr 4294913254,nop,wscale 6], length 0
01:43:30.448493 IP (tos 0x0, ttl 64, id 30988, offset 0, flags [DF], proto TCP (6), length 52)
    192.168.0.16.22 > 192.168.0.9.58022: Flags [.], cksum 0x32ee (correct), ack 44, win 453, options [nop,nop,TS val 50344 ecr 4294913254], length 0
01:43:30.452677 IP (tos 0x0, ttl 64, id 30989, offset 0, flags [DF], proto TCP (6), length 95)
    192.168.0.16.22 > 192.168.0.9.58022: Flags [P.], cksum 0xd766 (correct), seq 1:44, ack 44, win 453, options [nop,nop,TS val 50344 ecr 4294913254], length 43
01:43:30.453156 IP (tos 0x0, ttl 64, id 30990, offset 0, flags [DF], proto TCP (6), length 1700)
    192.168.0.16.22 > 192.168.0.9.58022: Flags [P.], cksum 0x8800 (incorrect -> 0x7f87), seq 44:1692, ack 44, win 453, options [nop,nop,TS val 50345 ecr 4294913255], length 1648
01:43:30.453239 IP (tos 0x0, ttl 64, id 30992, offset 0, flags [DF], proto TCP (6), length 52)
    192.168.0.16.22 > 192.168.0.9.58022: Flags [.], cksum 0x2464 (correct), ack 2012, win 514, options [nop,nop,TS val 50345 ecr 4294913255], length 0
01:43:30.457737 IP (tos 0x0, ttl 64, id 30993, offset 0, flags [DF], proto TCP (6), length 332)
    192.168.0.16.22 > 192.168.0.9.58022: Flags [P.], cksum 0x985a (correct), seq 1692:1972, ack 2060, win 514, options [nop,nop,TS val 50346 ecr 4294913256], length 280
01:43:30.496868 IP (tos 0x0, ttl 64, id 30994, offset 0, flags [DF], proto TCP (6), length 52)
    192.168.0.16.22 > 192.168.0.9.58022: Flags [.], cksum 0x22ff (correct), ack 2076, win 514, options [nop,nop,TS val 50356 ecr 4294913257], length 0
01:43:30.496952 IP (tos 0x0, ttl 64, id 30995, offset 0, flags [DF], proto TCP (6), length 52)
    192.168.0.16.22 > 192.168.0.9.58022: Flags [.], cksum 0x22c2 (correct), ack 2128, win 514, options [nop,nop,TS val 50356 ecr 4294913266], length 0
01:43:30.497051 IP (tos 0x0, ttl 64, id 30996, offset 0, flags [DF], proto TCP (6), length 104)
    192.168.0.16.22 > 192.168.0.9.58022: Flags [P.], cksum 0x8852 (correct), seq 1972:2024, ack 2128, win 514, options [nop,nop,TS val 50356 ecr 4294913266], length 52
01:43:30.520612 IP (tos 0x0, ttl 64, id 30997, offset 0, flags [DF], proto TCP (6), length 104)
    192.168.0.16.22 > 192.168.0.9.58022: Flags [P.], cksum 0x103f (correct), seq 2024:2076, ack 2196, win 514, options [nop,nop,TS val 50361 ecr 4294913266], length 52
01:43:30.521143 IP (tos 0x0, ttl 64, id 30998, offset 0, flags [DF], proto TCP (6), length 376)
    192.168.0.16.22 > 192.168.0.9.58022: Flags [P.], cksum 0xe15f (correct), seq 2076:2400, ack 2568, win 560, options [nop,nop,TS val 50362 ecr 4294913272], length 324
01:43:30.523511 IP (tos 0x0, ttl 64, id 30999, offset 0, flags [DF], proto TCP (6), length 88)
    192.168.0.16.22 > 192.168.0.9.58022: Flags [P.], cksum 0xc5ae (correct), seq 2400:2436, ack 3212, win 605, options [nop,nop,TS val 50362 ecr 4294913272], length 36
01:43:30.561311 IP (tos 0x0, ttl 64, id 31000, offset 0, flags [DF], proto TCP (6), length 52)
    192.168.0.16.22 > 192.168.0.9.58022: Flags [.], cksum 0x1bcc (correct), ack 3332, win 605, options [nop,nop,TS val 50372 ecr 4294913273], length 0
01:43:30.692440 IP (tos 0x0, ttl 64, id 31001, offset 0, flags [DF], proto TCP (6), length 104)
    192.168.0.16.22 > 192.168.0.9.58022: Flags [P.], cksum 0x2261 (correct), seq 2436:2488, ack 3332, win 605, options [nop,nop,TS val 50404 ecr 4294913273], length 52
01:43:30.692722 IP (tos 0x0, ttl 64, id 31002, offset 0, flags [DF], proto TCP (6), length 52)
    192.168.0.16.22 > 192.168.0.9.58022: Flags [.], cksum 0x1a98 (correct), ack 3468, win 650, options [nop,nop,TS val 50405 ecr 4294913315], length 0
01:43:30.693107 IP (tos 0x8, ttl 64, id 31003, offset 0, flags [DF], proto TCP (6), length 124)
    192.168.0.16.22 > 192.168.0.9.58022: Flags [P.], cksum 0xffdf (correct), seq 2488:2560, ack 3468, win 650, options [nop,nop,TS val 50405 ecr 4294913315], length 72
01:43:30.694788 IP (tos 0x8, ttl 64, id 31004, offset 0, flags [DF], proto TCP (6), length 88)
    192.168.0.16.22 > 192.168.0.9.58022: Flags [P.], cksum 0xb694 (correct), seq 2560:2596, ack 3468, win 650, options [nop,nop,TS val 50405 ecr 4294913315], length 36
01:43:30.695109 IP (tos 0x8, ttl 64, id 31005, offset 0, flags [DF], proto TCP (6), length 88)
    192.168.0.16.22 > 192.168.0.9.58022: Flags [P.], cksum 0xbe26 (correct), seq 2596:2632, ack 3536, win 650, options [nop,nop,TS val 50405 ecr 4294913315], length 36
01:43:30.695367 IP (tos 0x8, ttl 64, id 31006, offset 0, flags [DF], proto TCP (6), length 52)
    192.168.0.16.22 > 192.168.0.9.58022: Flags [.], cksum 0x026e (correct), ack 9328, win 831, options [nop,nop,TS val 50405 ecr 4294913316], length 0
01:43:30.695491 IP (tos 0x8, ttl 64, id 31007, offset 0, flags [DF], proto TCP (6), length 52)
    192.168.0.16.22 > 192.168.0.9.58022: Flags [.], cksum 0xe543 (correct), ack 16568, win 1057, options [nop,nop,TS val 50405 ecr 4294913316], length 0
01:43:30.695663 IP (tos 0x8, ttl 64, id 31008, offset 0, flags [DF], proto TCP (6), length 52)
    192.168.0.16.22 > 192.168.0.9.58022: Flags [.], cksum 0xd79d (correct), ack 19956, win 1163, options [nop,nop,TS val 50405 ecr 4294913316], length 0
01:43:30.695931 IP (tos 0x8, ttl 64, id 31009, offset 0, flags [DF], proto TCP (6), length 52)
    192.168.0.16.22 > 192.168.0.9.58022: Flags [.], cksum 0x9578 (correct), ack 36376, win 1676, options [nop,nop,TS val 50405 ecr 4294913316], length 0
01:43:30.695994 IP (tos 0x8, ttl 64, id 31010, offset 0, flags [DF], proto TCP (6), length 52)
    192.168.0.16.22 > 192.168.0.9.58022: Flags [.], cksum 0x66ce (correct), ack 47960, win 2038, options [nop,nop,TS val 50405 ecr 4294913316], length 0
01:43:30.696330 IP (tos 0x8, ttl 64, id 31011, offset 0, flags [DF], proto TCP (6), length 52)
    192.168.0.16.22 > 192.168.0.9.58022: Flags [.], cksum 0x5352 (correct), ack 52796, win 2190, options [nop,nop,TS val 50405 ecr 4294913316], length 0
01:43:30.696461 IP (tos 0x8, ttl 64, id 31012, offset 0, flags [DF], proto TCP (6), length 52)
    192.168.0.16.22 > 192.168.0.9.58022: Flags [.], cksum 0x1141 (correct), ack 69216, win 2683, options [nop,nop,TS val 50405 ecr 4294913316], length 0
01:43:30.696556 IP (tos 0x8, ttl 64, id 31013, offset 0, flags [DF], proto TCP (6), length 52)
    192.168.0.16.22 > 192.168.0.9.58022: Flags [.], cksum 0xd1d2 (correct), ack 85636, win 2501, options [nop,nop,TS val 50405 ecr 4294913316], length 0
01:43:30.697045 IP (tos 0x8, ttl 64, id 31014, offset 0, flags [DF], proto TCP (6), length 52)
    192.168.0.16.22 > 192.168.0.9.58022: Flags [.], cksum 0x3477 (correct), ack 125716, win 2703, options [nop,nop,TS val 50406 ecr 4294913316], length 0
01:43:30.697233 IP (tos 0x8, ttl 64, id 31015, offset 0, flags [DF], proto TCP (6), length 52)
    192.168.0.16.22 > 192.168.0.9.58022: Flags [.], cksum 0xcd56 (correct), ack 151316, win 3503, options [nop,nop,TS val 50406 ecr 4294913316], length 0
01:43:30.697383 IP (tos 0x8, ttl 64, id 31016, offset 0, flags [DF], proto TCP (6), length 52)
    192.168.0.16.22 > 192.168.0.9.58022: Flags [.], cksum 0x4c4c (correct), ack 184156, win 3697, options [nop,nop,TS val 50406 ecr 4294913316], length 0
01:43:30.697620 IP (tos 0x8, ttl 64, id 31017, offset 0, flags [DF], proto TCP (6), length 52)
    192.168.0.16.22 > 192.168.0.9.58022: Flags [.], cksum 0x0c28 (correct), ack 200576, win 3697, options [nop,nop,TS val 50406 ecr 4294913316], length 0
01:43:30.697934 IP (tos 0x8, ttl 64, id 31018, offset 0, flags [DF], proto TCP (6), length 52)
    192.168.0.16.22 > 192.168.0.9.58022: Flags [.], cksum 0x8c95 (correct), ack 233416, win 3515, options [nop,nop,TS val 50406 ecr 4294913316], length 0
01:43:30.698374 IP (tos 0x8, ttl 64, id 31019, offset 0, flags [DF], proto TCP (6), length 52)
    192.168.0.16.22 > 192.168.0.9.58022: Flags [.], cksum 0x0cb8 (correct), ack 266256, win 3408, options [nop,nop,TS val 50406 ecr 4294913316], length 0
01:43:30.698858 IP (tos 0x8, ttl 64, id 31020, offset 0, flags [DF], proto TCP (6), length 52)
    192.168.0.16.22 > 192.168.0.9.58022: Flags [.], cksum 0x8ddb (correct), ack 299096, win 3044, options [nop,nop,TS val 50406 ecr 4294913316], length 0
01:43:30.698861 IP (tos 0x8, ttl 64, id 31021, offset 0, flags [DF], proto TCP (6), length 88)
    192.168.0.16.22 > 192.168.0.9.58022: Flags [P.], cksum 0xa197 (correct), seq 2632:2668, ack 313576, win 2892, options [nop,nop,TS val 50406 ecr 4294913316], length 36
01:43:30.699017 IP (tos 0x8, ttl 64, id 31022, offset 0, flags [DF], proto TCP (6), length 52)
    192.168.0.16.22 > 192.168.0.9.58022: Flags [.], cksum 0x2250 (correct), ack 326608, win 3027, options [nop,nop,TS val 50406 ecr 4294913316], length 0
01:43:30.699365 IP (tos 0x8, ttl 64, id 31023, offset 0, flags [DF], proto TCP (6), length 52)
    192.168.0.16.22 > 192.168.0.9.58022: Flags [.], cksum 0x67a7 (correct), ack 374912, win 2507, options [nop,nop,TS val 50406 ecr 4294913316], length 0
01:43:30.699635 IP (tos 0x8, ttl 64, id 31024, offset 0, flags [DF], proto TCP (6), length 52)
    192.168.0.16.22 > 192.168.0.9.58022: Flags [.], cksum 0x0e8b (correct), ack 397616, win 2614, options [nop,nop,TS val 50406 ecr 4294913317], length 0
01:43:30.699953 IP (tos 0x8, ttl 64, id 31025, offset 0, flags [DF], proto TCP (6), length 52)
    192.168.0.16.22 > 192.168.0.9.58022: Flags [.], cksum 0x8ee9 (correct), ack 430456, win 2447, options [nop,nop,TS val 50406 ecr 4294913317], length 0
01:43:30.700386 IP (tos 0x8, ttl 64, id 31026, offset 0, flags [DF], proto TCP (6), length 52)
    192.168.0.16.22 > 192.168.0.9.58022: Flags [.], cksum 0xcfe9 (correct), ack 479716, win 2082, options [nop,nop,TS val 50406 ecr 4294913317], length 0
01:43:30.700718 IP (tos 0x8, ttl 64, id 31027, offset 0, flags [DF], proto TCP (6), length 88)
    192.168.0.16.22 > 192.168.0.9.58022: Flags [P.], cksum 0x2349 (correct), seq 2668:2704, ack 479716, win 2447, options [nop,nop,TS val 50406 ecr 4294913317], length 36
01:43:30.701009 IP (tos 0x8, ttl 64, id 31028, offset 0, flags [DF], proto TCP (6), length 52)
    192.168.0.16.22 > 192.168.0.9.58022: Flags [.], cksum 0x41eb (correct), ack 512556, win 5555, options [nop,nop,TS val 50407 ecr 4294913317], length 0
01:43:30.701054 IP (tos 0x8, ttl 64, id 31029, offset 0, flags [DF], proto TCP (6), length 52)
    192.168.0.16.22 > 192.168.0.9.58022: Flags [.], cksum 0xf040 (correct), ack 532828, win 6189, options [nop,nop,TS val 50407 ecr 4294913317], length 0
01:43:30.701255 IP (tos 0x8, ttl 64, id 31030, offset 0, flags [DF], proto TCP (6), length 52)
    192.168.0.16.22 > 192.168.0.9.58022: Flags [.], cksum 0x816d (correct), ack 560340, win 7048, options [nop,nop,TS val 50407 ecr 4294913317], length 0
01:43:30.701280 IP (tos 0x8, ttl 64, id 31031, offset 0, flags [DF], proto TCP (6), length 52)
    192.168.0.16.22 > 192.168.0.9.58022: Flags [.], cksum 0x0cc4 (correct), ack 589300, win 7953, options [nop,nop,TS val 50407 ecr 4294913317], length 0
01:43:30.701491 IP (tos 0x8, ttl 64, id 31032, offset 0, flags [DF], proto TCP (6), length 52)
    192.168.0.16.22 > 192.168.0.9.58022: Flags [.], cksum 0x72e5 (correct), ack 627496, win 9147, options [nop,nop,TS val 50407 ecr 4294913317], length 0
01:43:30.701714 IP (tos 0x8, ttl 64, id 31033, offset 0, flags [DF], proto TCP (6), length 52)
    192.168.0.16.22 > 192.168.0.9.58022: Flags [.], cksum 0x3171 (correct), ack 643916, win 9483, options [nop,nop,TS val 50407 ecr 4294913317], length 0
01:43:30.701826 IP (tos 0x8, ttl 64, id 31034, offset 0, flags [DF], proto TCP (6), length 52)
    192.168.0.16.22 > 192.168.0.9.58022: Flags [.], cksum 0xfe5b (correct), ack 656948, win 9528, options [nop,nop,TS val 50407 ecr 4294913317], length 0
01:43:30.702020 IP (tos 0x8, ttl 64, id 31035, offset 0, flags [DF], proto TCP (6), length 52)
    192.168.0.16.22 > 192.168.0.9.58022: Flags [.], cksum 0xb137 (correct), ack 676756, win 9468, options [nop,nop,TS val 50407 ecr 4294913317], length 0
01:43:30.702333 IP (tos 0x8, ttl 64, id 31036, offset 0, flags [DF], proto TCP (6), length 52)
    192.168.0.16.22 > 192.168.0.9.58022: Flags [.], cksum 0x31d2 (correct), ack 709596, win 9241, options [nop,nop,TS val 50407 ecr 4294913317], length 0
01:43:30.702726 IP (tos 0x8, ttl 64, id 31037, offset 0, flags [DF], proto TCP (6), length 52)
    192.168.0.16.22 > 192.168.0.9.58022: Flags [.], cksum 0xb20e (correct), ack 742436, win 9108, options [nop,nop,TS val 50407 ecr 4294913317], length 0
01:43:30.703214 IP (tos 0x8, ttl 64, id 31038, offset 0, flags [DF], proto TCP (6), length 52)
    192.168.0.16.22 > 192.168.0.9.58022: Flags [.], cksum 0x3211 (correct), ack 775276, win 9033, options [nop,nop,TS val 50407 ecr 4294913317], length 0
01:43:30.703233 IP (tos 0x8, ttl 64, id 31039, offset 0, flags [DF], proto TCP (6), length 88)
    192.168.0.16.22 > 192.168.0.9.58022: Flags [P.], cksum 0x58ac (correct), seq 2704:2740, ack 791696, win 8851, options [nop,nop,TS val 50407 ecr 4294913317], length 36
01:43:30.703547 IP (tos 0x8, ttl 64, id 31040, offset 0, flags [DF], proto TCP (6), length 52)
    192.168.0.16.22 > 192.168.0.9.58022: Flags [.], cksum 0x72a2 (correct), ack 824536, win 8742, options [nop,nop,TS val 50407 ecr 4294913318], length 0
01:43:30.703965 IP (tos 0x8, ttl 64, id 31041, offset 0, flags [DF], proto TCP (6), length 52)
    192.168.0.16.22 > 192.168.0.9.58022: Flags [.], cksum 0x8775 (correct), ack 885380, win 8102, options [nop,nop,TS val 50407 ecr 4294913318], length 0
01:43:30.704211 IP (tos 0x8, ttl 64, id 31042, offset 0, flags [DF], proto TCP (6), length 52)
    192.168.0.16.22 > 192.168.0.9.58022: Flags [.], cksum 0x34a3 (correct), ack 906460, win 8224, options [nop,nop,TS val 50407 ecr 4294913318], length 0
01:43:30.704538 IP (tos 0x8, ttl 64, id 31043, offset 0, flags [DF], proto TCP (6), length 88)
    192.168.0.16.22 > 192.168.0.9.58022: Flags [P.], cksum 0x3135 (correct), seq 2740:2776, ack 906460, win 8770, options [nop,nop,TS val 50407 ecr 4294913318], length 36
01:43:30.705325 IP (tos 0x8, ttl 64, id 31044, offset 0, flags [DF], proto TCP (6), length 88)
    192.168.0.16.22 > 192.168.0.9.58022: Flags [P.], cksum 0xb590 (correct), seq 2776:2812, ack 906460, win 9660, options [nop,nop,TS val 50408 ecr 4294913318], length 36
01:43:30.705998 IP (tos 0x8, ttl 64, id 31045, offset 0, flags [DF], proto TCP (6), length 88)
    192.168.0.16.22 > 192.168.0.9.58022: Flags [P.], cksum 0x0648 (correct), seq 2812:2848, ack 906460, win 9660, options [nop,nop,TS val 50408 ecr 4294913318], length 36
01:43:30.706656 IP (tos 0x8, ttl 64, id 31046, offset 0, flags [DF], proto TCP (6), length 88)
    192.168.0.16.22 > 192.168.0.9.58022: Flags [P.], cksum 0xe1c9 (correct), seq 2848:2884, ack 906460, win 9660, options [nop,nop,TS val 50408 ecr 4294913318], length 36
01:43:30.707399 IP (tos 0x8, ttl 64, id 31047, offset 0, flags [DF], proto TCP (6), length 88)
    192.168.0.16.22 > 192.168.0.9.58022: Flags [P.], cksum 0x7601 (correct), seq 2884:2920, ack 906460, win 9660, options [nop,nop,TS val 50408 ecr 4294913318], length 36
01:43:30.707404 IP (tos 0x8, ttl 64, id 31048, offset 0, flags [DF], proto TCP (6), length 88)
    192.168.0.16.22 > 192.168.0.9.58022: Flags [P.], cksum 0xc5ab (correct), seq 2920:2956, ack 906460, win 9660, options [nop,nop,TS val 50408 ecr 4294913318], length 36
01:43:30.707826 IP (tos 0x8, ttl 64, id 31049, offset 0, flags [DF], proto TCP (6), length 176)
    192.168.0.16.22 > 192.168.0.9.58022: Flags [P.], cksum 0x4767 (correct), seq 2956:3080, ack 906496, win 9660, options [nop,nop,TS val 50408 ecr 4294913319], length 124
01:43:30.708057 IP (tos 0x8, ttl 64, id 31050, offset 0, flags [DF], proto TCP (6), length 52)
    192.168.0.16.22 > 192.168.0.9.58022: Flags [.], cksum 0x2d25 (correct), ack 906600, win 9660, options [nop,nop,TS val 50408 ecr 4294913319], length 0
01:43:30.710445 IP (tos 0x8, ttl 64, id 31051, offset 0, flags [DF], proto TCP (6), length 52)
    192.168.0.16.22 > 192.168.0.9.58022: Flags [F.], cksum 0x2d22 (correct), seq 3080, ack 906601, win 9660, options [nop,nop,TS val 50409 ecr 4294913319], length 0
01:43:30.711545 IP (tos 0x0, ttl 64, id 0, offset 0, flags [DF], proto TCP (6), length 60)
    192.168.0.7.22 > 192.168.0.9.38522: Flags [S.], cksum 0x0ae6 (correct), seq 482415446, ack 3113139925, win 28960, options [mss 1460,sackOK,TS val 56917 ecr 4294913320,nop,wscale 6], length 0
01:43:30.711967 IP (tos 0x0, ttl 64, id 52482, offset 0, flags [DF], proto TCP (6), length 52)
    192.168.0.7.22 > 192.168.0.9.38522: Flags [.], cksum 0xa8e1 (correct), ack 44, win 453, options [nop,nop,TS val 56917 ecr 4294913320], length 0
01:43:30.715187 IP (tos 0x0, ttl 64, id 52483, offset 0, flags [DF], proto TCP (6), length 95)
    192.168.0.7.22 > 192.168.0.9.38522: Flags [P.], cksum 0x4d59 (correct), seq 1:44, ack 44, win 453, options [nop,nop,TS val 56918 ecr 4294913320], length 43
01:43:30.715608 IP (tos 0x0, ttl 64, id 52484, offset 0, flags [DF], proto TCP (6), length 1700)
    192.168.0.7.22 > 192.168.0.9.38522: Flags [P.], cksum 0x87f7 (incorrect -> 0x57fd), seq 44:1692, ack 44, win 453, options [nop,nop,TS val 56918 ecr 4294913321], length 1648
01:43:30.715993 IP (tos 0x0, ttl 64, id 52486, offset 0, flags [DF], proto TCP (6), length 52)
    192.168.0.7.22 > 192.168.0.9.38522: Flags [.], cksum 0x9a57 (correct), ack 2012, win 514, options [nop,nop,TS val 56918 ecr 4294913321], length 0
01:43:30.721444 IP (tos 0x0, ttl 64, id 52487, offset 0, flags [DF], proto TCP (6), length 332)
    192.168.0.7.22 > 192.168.0.9.38522: Flags [P.], cksum 0xd35e (correct), seq 1692:1972, ack 2060, win 514, options [nop,nop,TS val 56919 ecr 4294913321], length 280
01:43:30.762994 IP (tos 0x0, ttl 64, id 52488, offset 0, flags [DF], proto TCP (6), length 52)
    192.168.0.7.22 > 192.168.0.9.38522: Flags [.], cksum 0x98f1 (correct), ack 2076, win 514, options [nop,nop,TS val 56930 ecr 4294913323], length 0
01:43:30.763105 IP (tos 0x0, ttl 64, id 52489, offset 0, flags [DF], proto TCP (6), length 52)
    192.168.0.7.22 > 192.168.0.9.38522: Flags [.], cksum 0x98b4 (correct), ack 2128, win 514, options [nop,nop,TS val 56930 ecr 4294913332], length 0
01:43:30.763232 IP (tos 0x0, ttl 64, id 52490, offset 0, flags [DF], proto TCP (6), length 104)
    192.168.0.7.22 > 192.168.0.9.38522: Flags [P.], cksum 0xd9af (correct), seq 1972:2024, ack 2128, win 514, options [nop,nop,TS val 56930 ecr 4294913332], length 52
01:43:30.779160 IP (tos 0x0, ttl 64, id 52491, offset 0, flags [DF], proto TCP (6), length 104)
    192.168.0.7.22 > 192.168.0.9.38522: Flags [P.], cksum 0x3102 (correct), seq 2024:2076, ack 2196, win 514, options [nop,nop,TS val 56933 ecr 4294913333], length 52
01:43:30.779606 IP (tos 0x0, ttl 64, id 52492, offset 0, flags [DF], proto TCP (6), length 376)
    192.168.0.7.22 > 192.168.0.9.38522: Flags [P.], cksum 0xc892 (correct), seq 2076:2400, ack 2568, win 560, options [nop,nop,TS val 56934 ecr 4294913337], length 324
01:43:30.782153 IP (tos 0x0, ttl 64, id 52493, offset 0, flags [DF], proto TCP (6), length 88)
    192.168.0.7.22 > 192.168.0.9.38522: Flags [P.], cksum 0xbb65 (correct), seq 2400:2436, ack 3212, win 605, options [nop,nop,TS val 56934 ecr 4294913337], length 36
01:43:30.823491 IP (tos 0x0, ttl 64, id 52494, offset 0, flags [DF], proto TCP (6), length 52)
    192.168.0.7.22 > 192.168.0.9.38522: Flags [.], cksum 0x91c1 (correct), ack 3332, win 605, options [nop,nop,TS val 56945 ecr 4294913337], length 0
01:43:30.943016 IP (tos 0x0, ttl 64, id 52495, offset 0, flags [DF], proto TCP (6), length 104)
    192.168.0.7.22 > 192.168.0.9.38522: Flags [P.], cksum 0x4194 (correct), seq 2436:2488, ack 3332, win 605, options [nop,nop,TS val 56974 ecr 4294913337], length 52
01:43:30.943266 IP (tos 0x0, ttl 64, id 52496, offset 0, flags [DF], proto TCP (6), length 52)
    192.168.0.7.22 > 192.168.0.9.38522: Flags [.], cksum 0x9092 (correct), ack 3468, win 650, options [nop,nop,TS val 56975 ecr 4294913377], length 0
01:43:30.943585 IP (tos 0x8, ttl 64, id 52497, offset 0, flags [DF], proto TCP (6), length 124)
    192.168.0.7.22 > 192.168.0.9.38522: Flags [P.], cksum 0x82be (correct), seq 2488:2560, ack 3468, win 650, options [nop,nop,TS val 56975 ecr 4294913377], length 72
01:43:30.945017 IP (tos 0x8, ttl 64, id 52498, offset 0, flags [DF], proto TCP (6), length 88)
    192.168.0.7.22 > 192.168.0.9.38522: Flags [P.], cksum 0xe1ef (correct), seq 2560:2596, ack 3468, win 650, options [nop,nop,TS val 56975 ecr 4294913377], length 36
01:43:30.945462 IP (tos 0x8, ttl 64, id 52499, offset 0, flags [DF], proto TCP (6), length 88)
    192.168.0.7.22 > 192.168.0.9.38522: Flags [P.], cksum 0x6c40 (correct), seq 2596:2632, ack 3536, win 650, options [nop,nop,TS val 56975 ecr 4294913378], length 36
01:43:30.945798 IP (tos 0x8, ttl 64, id 52500, offset 0, flags [DF], proto TCP (6), length 52)
    192.168.0.7.22 > 192.168.0.9.38522: Flags [.], cksum 0x7868 (correct), ack 9328, win 831, options [nop,nop,TS val 56975 ecr 4294913378], length 0
01:43:30.945900 IP (tos 0x8, ttl 64, id 52501, offset 0, flags [DF], proto TCP (6), length 52)
    192.168.0.7.22 > 192.168.0.9.38522: Flags [.], cksum 0x6113 (correct), ack 15120, win 1012, options [nop,nop,TS val 56975 ecr 4294913378], length 0
01:43:30.946011 IP (tos 0x8, ttl 64, id 52502, offset 0, flags [DF], proto TCP (6), length 52)
    192.168.0.7.22 > 192.168.0.9.38522: Flags [.], cksum 0x4d98 (correct), ack 19956, win 1163, options [nop,nop,TS val 56975 ecr 4294913378], length 0
01:43:30.946309 IP (tos 0x8, ttl 64, id 52503, offset 0, flags [DF], proto TCP (6), length 52)
    192.168.0.7.22 > 192.168.0.9.38522: Flags [.], cksum 0x0b73 (correct), ack 36376, win 1676, options [nop,nop,TS val 56975 ecr 4294913378], length 0
01:43:30.946428 IP (tos 0x8, ttl 64, id 52504, offset 0, flags [DF], proto TCP (6), length 52)
    192.168.0.7.22 > 192.168.0.9.38522: Flags [.], cksum 0xc94c (correct), ack 52796, win 2190, options [nop,nop,TS val 56975 ecr 4294913378], length 0
01:43:30.946574 IP (tos 0x8, ttl 64, id 52505, offset 0, flags [DF], proto TCP (6), length 52)
    192.168.0.7.22 > 192.168.0.9.38522: Flags [.], cksum 0x94cd (correct), ack 65828, win 2597, options [nop,nop,TS val 56975 ecr 4294913378], length 0
01:43:30.946772 IP (tos 0x8, ttl 64, id 52506, offset 0, flags [DF], proto TCP (6), length 52)
    192.168.0.7.22 > 192.168.0.9.38522: Flags [.], cksum 0x8727 (correct), ack 69216, win 2703, options [nop,nop,TS val 56975 ecr 4294913378], length 0
01:43:30.946868 IP (tos 0x8, ttl 64, id 52507, offset 0, flags [DF], proto TCP (6), length 52)
    192.168.0.7.22 > 192.168.0.9.38522: Flags [.], cksum 0x4708 (correct), ack 85636, win 2698, options [nop,nop,TS val 56975 ecr 4294913378], length 0
01:43:30.947179 IP (tos 0x8, ttl 64, id 52508, offset 0, flags [DF], proto TCP (6), length 52)
    192.168.0.7.22 > 192.168.0.9.38522: Flags [.], cksum 0xd99d (correct), ack 113640, win 2703, options [nop,nop,TS val 56976 ecr 4294913378], length 0
01:43:30.947366 IP (tos 0x8, ttl 64, id 52509, offset 0, flags [DF], proto TCP (6), length 52)
    192.168.0.7.22 > 192.168.0.9.38522: Flags [.], cksum 0x83fc (correct), ack 134896, win 3367, options [nop,nop,TS val 56976 ecr 4294913379], length 0
01:43:30.947574 IP (tos 0x8, ttl 64, id 52510, offset 0, flags [DF], proto TCP (6), length 52)
    192.168.0.7.22 > 192.168.0.9.38522: Flags [.], cksum 0x41d7 (correct), ack 151316, win 3880, options [nop,nop,TS val 56976 ecr 4294913379], length 0
01:43:30.947690 IP (tos 0x8, ttl 64, id 52511, offset 0, flags [DF], proto TCP (6), length 52)
    192.168.0.7.22 > 192.168.0.9.38522: Flags [.], cksum 0xffb1 (correct), ack 167736, win 4393, options [nop,nop,TS val 56976 ecr 4294913379], length 0
01:43:30.947816 IP (tos 0x8, ttl 64, id 52512, offset 0, flags [DF], proto TCP (6), length 52)
    192.168.0.7.22 > 192.168.0.9.38522: Flags [.], cksum 0xbd8c (correct), ack 184156, win 4906, options [nop,nop,TS val 56976 ecr 4294913379], length 0
01:43:30.947964 IP (tos 0x8, ttl 64, id 52513, offset 0, flags [DF], proto TCP (6), length 52)
    192.168.0.7.22 > 192.168.0.9.38522: Flags [.], cksum 0x7cee (correct), ack 200576, win 5028, options [nop,nop,TS val 56976 ecr 4294913379], length 0
01:43:30.948193 IP (tos 0x8, ttl 64, id 52514, offset 0, flags [DF], proto TCP (6), length 52)
    192.168.0.7.22 > 192.168.0.9.38522: Flags [.], cksum 0x3c9d (correct), ack 216996, win 5073, options [nop,nop,TS val 56976 ecr 4294913379], length 0
01:43:30.948332 IP (tos 0x8, ttl 64, id 52515, offset 0, flags [DF], proto TCP (6), length 88)
    192.168.0.7.22 > 192.168.0.9.38522: Flags [P.], cksum 0x2ed5 (correct), seq 2632:2668, ack 247404, win 4756, options [nop,nop,TS val 56976 ecr 4294913379], length 36
01:43:30.948697 IP (tos 0x8, ttl 64, id 52516, offset 0, flags [DF], proto TCP (6), length 52)
    192.168.0.7.22 > 192.168.0.9.38522: Flags [.], cksum 0x4b08 (correct), ack 279288, win 4589, options [nop,nop,TS val 56976 ecr 4294913379], length 0
01:43:30.949153 IP (tos 0x8, ttl 64, id 52517, offset 0, flags [DF], proto TCP (6), length 52)
    192.168.0.7.22 > 192.168.0.9.38522: Flags [.], cksum 0xcb75 (correct), ack 312128, win 4407, options [nop,nop,TS val 56976 ecr 4294913379], length 0
01:43:30.949534 IP (tos 0x8, ttl 64, id 52518, offset 0, flags [DF], proto TCP (6), length 52)
    192.168.0.7.22 > 192.168.0.9.38522: Flags [.], cksum 0x7e33 (correct), ack 331936, win 4377, options [nop,nop,TS val 56976 ecr 4294913379], length 0
01:43:30.949773 IP (tos 0x8, ttl 64, id 52519, offset 0, flags [DF], proto TCP (6), length 52)
    192.168.0.7.22 > 192.168.0.9.38522: Flags [.], cksum 0xedc6 (correct), ack 369120, win 4165, options [nop,nop,TS val 56976 ecr 4294913379], length 0
01:43:30.950165 IP (tos 0x8, ttl 64, id 52520, offset 0, flags [DF], proto TCP (6), length 52)
    192.168.0.7.22 > 192.168.0.9.38522: Flags [.], cksum 0x5796 (correct), ack 407752, win 3981, options [nop,nop,TS val 56976 ecr 4294913379], length 0
01:43:30.950543 IP (tos 0x8, ttl 64, id 52521, offset 0, flags [DF], proto TCP (6), length 88)
    192.168.0.7.22 > 192.168.0.9.38522: Flags [P.], cksum 0x666e (correct), seq 2668:2704, ack 407752, win 4253, options [nop,nop,TS val 56976 ecr 4294913379], length 36
01:43:30.950698 IP (tos 0x8, ttl 64, id 52522, offset 0, flags [DF], proto TCP (6), length 52)
    192.168.0.7.22 > 192.168.0.9.38522: Flags [.], cksum 0xfd19 (correct), ack 430456, win 4405, options [nop,nop,TS val 56976 ecr 4294913379], length 0
