04:47:56.697304 ARP, Request who-has 192.168.0.9 tell 192.168.0.10, length 46
04:47:56.703745 ARP, Reply 192.168.0.16 is-at 08:00:27:26:85:17, length 28
04:47:56.704068 IP 192.168.0.16 > 192.168.0.10: ICMP 192.168.0.16 udp port 5000 unreachable, length 41
04:47:56.705136 ARP, Request who-has 192.168.0.9 tell 192.168.0.10, length 28
04:47:56.705736 IP 192.168.0.10.5000 > 192.168.0.9.5000: UDP, length 5
04:47:56.711416 ARP, Request who-has 192.168.0.16 tell 192.168.0.10, length 28
04:47:56.711504 ARP, Reply 192.168.0.9 is-at 08:00:27:b6:f4:04, length 28
04:47:56.711797 IP 192.168.0.10.5000 > 192.168.0.16.5000: UDP, length 5
04:47:56.712072 IP 192.168.0.9 > 192.168.0.10: ICMP 192.168.0.9 udp port 5000 unreachable, length 41
04:47:56.718218 ARP, Request who-has 192.168.0.16 tell 192.168.0.10, length 46
04:47:58.723807 IP 192.168.0.10.5000 > 192.168.0.9.5000: UDP, length 5
04:47:58.724712 IP 192.168.0.16 > 192.168.0.10: ICMP 192.168.0.16 udp port 5000 unreachable, length 41
04:47:58.730182 IP 192.168.0.9 > 192.168.0.10: ICMP 192.168.0.9 udp port 5000 unreachable, length 41
04:47:58.732340 IP 192.168.0.10.5000 > 192.168.0.16.5000: UDP, length 5
04:47:59.003164 IP 192.168.0.10 > 192.168.0.9: ICMP 192.168.0.10 udp port 5000 unreachable, length 41
04:47:59.005910 ARP, Reply 192.168.0.16 is-at 08:00:27:26:85:17, length 28
04:47:59.006293 IP 192.168.0.16 > 192.168.0.9: ICMP 192.168.0.16 udp port 5000 unreachable, length 41
04:47:59.009132 IP 192.168.0.9.5000 > 192.168.0.10.5000: UDP, length 5
04:47:59.013900 ARP, Request who-has 192.168.0.16 tell 192.168.0.9, length 46
04:47:59.019920 ARP, Request who-has 192.168.0.16 tell 192.168.0.9, length 28
04:47:59.020708 IP 192.168.0.9.5000 > 192.168.0.16.5000: UDP, length 5
04:48:01.626037 IP 192.168.0.16.5000 > 192.168.0.9.5000: UDP, length 5
04:48:01.632711 IP 192.168.0.16.5000 > 192.168.0.10.5000: UDP, length 5
04:48:01.640134 IP 192.168.0.9 > 192.168.0.16: ICMP 192.168.0.9 udp port 5000 unreachable, length 41
04:48:01.640865 IP 192.168.0.10 > 192.168.0.16: ICMP 192.168.0.10 udp port 5000 unreachable, length 41
04:48:01.712007 ARP, Request who-has 192.168.0.10 tell 192.168.0.16, length 28
04:48:01.720171 ARP, Reply 192.168.0.10 is-at 08:00:27:f4:2b:89, length 28
04:48:01.744545 IP 192.168.0.10.5000 > 192.168.0.9.5000: UDP, length 5
04:48:01.745701 IP 192.168.0.16 > 192.168.0.10: ICMP 192.168.0.16 udp port 5000 unreachable, length 41
04:48:01.751529 IP 192.168.0.9 > 192.168.0.10: ICMP 192.168.0.9 udp port 5000 unreachable, length 41
04:48:01.753366 IP 192.168.0.10.5000 > 192.168.0.16.5000: UDP, length 5
04:48:02.030859 IP 192.168.0.10 > 192.168.0.9: ICMP 192.168.0.10 udp port 5000 unreachable, length 41
04:48:02.036227 IP 192.168.0.9.5000 > 192.168.0.10.5000: UDP, length 5
04:48:02.037356 IP 192.168.0.16 > 192.168.0.9: ICMP 192.168.0.16 udp port 5000 unreachable, length 41
04:48:02.051119 IP 192.168.0.9.5000 > 192.168.0.16.5000: UDP, length 5
04:48:02.651583 IP 192.168.0.16.5000 > 192.168.0.9.5000: UDP, length 5
04:48:02.662155 IP 192.168.0.16.5000 > 192.168.0.10.5000: UDP, length 5
04:48:02.666143 IP 192.168.0.9 > 192.168.0.16: ICMP 192.168.0.9 udp port 5000 unreachable, length 41
04:48:02.670240 IP 192.168.0.10 > 192.168.0.16: ICMP 192.168.0.10 udp port 5000 unreachable, length 41
04:48:03.735514 ARP, Reply 192.168.0.10 is-at 08:00:27:f4:2b:89, length 28
04:48:03.742069 ARP, Request who-has 192.168.0.10 tell 192.168.0.9, length 28
04:48:04.016808 ARP, Request who-has 192.168.0.9 tell 192.168.0.16, length 28
04:48:04.031302 ARP, Reply 192.168.0.9 is-at 08:00:27:b6:f4:04, length 28
04:48:04.058615 IP 192.168.0.10 > 192.168.0.9: ICMP 192.168.0.10 udp port 5000 unreachable, length 41
04:48:04.061625 IP 192.168.0.16 > 192.168.0.9: ICMP 192.168.0.16 udp port 5000 unreachable, length 41
04:48:04.064612 IP 192.168.0.9.5000 > 192.168.0.10.5000: UDP, length 5
04:48:04.075583 IP 192.168.0.9.5000 > 192.168.0.16.5000: UDP, length 5
04:48:04.678595 IP 192.168.0.16.5000 > 192.168.0.9.5000: UDP, length 5
04:48:04.693018 IP 192.168.0.9 > 192.168.0.16: ICMP 192.168.0.9 udp port 5000 unreachable, length 41
04:48:04.693435 IP 192.168.0.16.5000 > 192.168.0.10.5000: UDP, length 5
04:48:04.701351 IP 192.168.0.10 > 192.168.0.16: ICMP 192.168.0.10 udp port 5000 unreachable, length 41
04:48:05.767457 IP 192.168.0.10.5000 > 192.168.0.9.5000: UDP, length 5
04:48:05.768505 IP 192.168.0.16 > 192.168.0.10: ICMP 192.168.0.16 udp port 5000 unreachable, length 41
04:48:05.774143 IP 192.168.0.9 > 192.168.0.10: ICMP 192.168.0.9 udp port 5000 unreachable, length 41
04:48:05.776069 IP 192.168.0.10.5000 > 192.168.0.16.5000: UDP, length 5
04:48:09.084622 IP 192.168.0.10 > 192.168.0.9: ICMP 192.168.0.10 udp port 5000 unreachable, length 41
04:48:09.085296 IP 192.168.0.16 > 192.168.0.9: ICMP 192.168.0.16 udp port 5000 unreachable, length 41
04:48:09.090566 IP 192.168.0.9.5000 > 192.168.0.10.5000: UDP, length 5
04:48:09.099714 IP 192.168.0.9.5000 > 192.168.0.16.5000: UDP, length 5
04:48:09.712918 IP 192.168.0.16.5000 > 192.168.0.9.5000: UDP, length 5
04:48:09.725021 IP 192.168.0.16.5000 > 192.168.0.10.5000: UDP, length 5
04:48:09.726984 IP 192.168.0.9 > 192.168.0.16: ICMP 192.168.0.9 udp port 5000 unreachable, length 41
04:48:09.732969 IP 192.168.0.10 > 192.168.0.16: ICMP 192.168.0.10 udp port 5000 unreachable, length 41
04:48:10.794104 IP 192.168.0.10.5000 > 192.168.0.9.5000: UDP, length 5
04:48:10.801067 IP 192.168.0.9 > 192.168.0.10: ICMP 192.168.0.9 udp port 5000 unreachable, length 41
04:48:10.801450 IP 192.168.0.16 > 192.168.0.10: ICMP 192.168.0.16 udp port 5000 unreachable, length 41
04:48:10.809461 IP 192.168.0.10.5000 > 192.168.0.16.5000: UDP, length 5
04:48:12.111814 IP 192.168.0.10 > 192.168.0.9: ICMP 192.168.0.10 udp port 5000 unreachable, length 41
04:48:12.112454 IP 192.168.0.16 > 192.168.0.9: ICMP 192.168.0.16 udp port 5000 unreachable, length 41
04:48:12.117214 IP 192.168.0.9.5000 > 192.168.0.10.5000: UDP, length 5
04:48:12.126696 IP 192.168.0.9.5000 > 192.168.0.16.5000: UDP, length 5
04:48:13.825556 IP 192.168.0.10.5000 > 192.168.0.9.5000: UDP, length 5
04:48:13.826679 IP 192.168.0.16 > 192.168.0.10: ICMP 192.168.0.16 udp port 5000 unreachable, length 41
04:48:13.832616 IP 192.168.0.9 > 192.168.0.10: ICMP 192.168.0.9 udp port 5000 unreachable, length 41
04:48:13.834761 IP 192.168.0.10.5000 > 192.168.0.16.5000: UDP, length 5
04:48:14.743677 IP 192.168.0.16.5000 > 192.168.0.9.5000: UDP, length 5
04:48:14.756103 IP 192.168.0.16.5000 > 192.168.0.10.5000: UDP, length 5
04:48:14.758716 IP 192.168.0.9 > 192.168.0.16: ICMP 192.168.0.9 udp port 5000 unreachable, length 41
04:48:14.764393 IP 192.168.0.10 > 192.168.0.16: ICMP 192.168.0.10 udp port 5000 unreachable, length 41
04:48:16.130071 IP 192.168.0.16 > 192.168.0.9: ICMP 192.168.0.16 udp port 5000 unreachable, length 41
04:48:16.130166 IP 192.168.0.10 > 192.168.0.9: ICMP 192.168.0.10 udp port 5000 unreachable, length 41
04:48:16.136577 IP 192.168.0.9.5000 > 192.168.0.10.5000: UDP, length 5
04:48:16.143922 IP 192.168.0.9.5000 > 192.168.0.16.5000: UDP, length 5
04:48:17.156148 IP 192.168.0.10 > 192.168.0.9: ICMP 192.168.0.10 udp port 5000 unreachable, length 41
04:48:17.157003 IP 192.168.0.16 > 192.168.0.9: ICMP 192.168.0.16 udp port 5000 unreachable, length 41
04:48:17.162663 IP 192.168.0.9.5000 > 192.168.0.10.5000: UDP, length 5
04:48:17.170717 IP 192.168.0.9.5000 > 192.168.0.16.5000: UDP, length 5
04:48:17.850731 IP 192.168.0.10.5000 > 192.168.0.9.5000: UDP, length 5
04:48:17.857256 IP 192.168.0.9 > 192.168.0.10: ICMP 192.168.0.9 udp port 5000 unreachable, length 41
04:48:17.857295 IP 192.168.0.16 > 192.168.0.10: ICMP 192.168.0.16 udp port 5000 unreachable, length 41
04:48:17.864827 IP 192.168.0.10.5000 > 192.168.0.16.5000: UDP, length 5
04:48:19.772765 IP 192.168.0.16.5000 > 192.168.0.9.5000: UDP, length 5
04:48:19.782301 IP 192.168.0.16.5000 > 192.168.0.10.5000: UDP, length 5
04:48:19.787508 IP 192.168.0.9 > 192.168.0.16: ICMP 192.168.0.9 udp port 5000 unreachable, length 41
04:48:19.790144 IP 192.168.0.10 > 192.168.0.16: ICMP 192.168.0.10 udp port 5000 unreachable, length 41
04:48:19.881430 IP 192.168.0.10.5000 > 192.168.0.9.5000: UDP, length 5
04:48:19.888171 IP 192.168.0.9 > 192.168.0.10: ICMP 192.168.0.9 udp port 5000 unreachable, length 41
04:48:19.888316 IP 192.168.0.16 > 192.168.0.10: ICMP 192.168.0.16 udp port 5000 unreachable, length 41
04:48:19.895573 IP 192.168.0.10.5000 > 192.168.0.16.5000: UDP, length 5
04:48:20.178384 IP 192.168.0.10 > 192.168.0.9: ICMP 192.168.0.10 udp port 5000 unreachable, length 41
04:48:20.181684 IP 192.168.0.16 > 192.168.0.9: ICMP 192.168.0.16 udp port 5000 unreachable, length 41
04:48:20.183858 IP 192.168.0.9.5000 > 192.168.0.10.5000: UDP, length 5
04:48:20.196015 IP 192.168.0.9.5000 > 192.168.0.16.5000: UDP, length 5
04:48:20.913083 IP 192.168.0.10.5000 > 192.168.0.9.5000: UDP, length 5
04:48:20.919526 IP 192.168.0.9 > 192.168.0.10: ICMP 192.168.0.9 udp port 5000 unreachable, length 41
04:48:20.920599 IP 192.168.0.16 > 192.168.0.10: ICMP 192.168.0.16 udp port 5000 unreachable, length 41
04:48:20.927957 IP 192.168.0.10.5000 > 192.168.0.16.5000: UDP, length 5
04:48:22.798232 IP 192.168.0.16.5000 > 192.168.0.9.5000: UDP, length 5
04:48:22.812659 IP 192.168.0.16.5000 > 192.168.0.10.5000: UDP, length 5
04:48:22.813068 IP 192.168.0.9 > 192.168.0.16: ICMP 192.168.0.9 udp port 5000 unreachable, length 41
04:48:22.820820 IP 192.168.0.10 > 192.168.0.16: ICMP 192.168.0.10 udp port 5000 unreachable, length 41
04:48:22.944667 IP 192.168.0.10.5000 > 192.168.0.9.5000: UDP, length 5
04:48:22.945584 IP 192.168.0.16 > 192.168.0.10: ICMP 192.168.0.16 udp port 5000 unreachable, length 41
04:48:22.950756 IP 192.168.0.9 > 192.168.0.10: ICMP 192.168.0.9 udp port 5000 unreachable, length 41
04:48:22.953591 IP 192.168.0.10.5000 > 192.168.0.16.5000: UDP, length 5
04:48:24.206821 IP 192.168.0.10 > 192.168.0.9: ICMP 192.168.0.10 udp port 5000 unreachable, length 41
04:48:24.206980 IP 192.168.0.16 > 192.168.0.9: ICMP 192.168.0.16 udp port 5000 unreachable, length 41
04:48:24.212337 IP 192.168.0.9.5000 > 192.168.0.10.5000: UDP, length 5
04:48:24.221283 IP 192.168.0.9.5000 > 192.168.0.16.5000: UDP, length 5
04:48:24.968825 IP 192.168.0.10.5000 > 192.168.0.9.5000: UDP, length 5
04:48:24.975429 IP 192.168.0.16 > 192.168.0.10: ICMP 192.168.0.16 udp port 5000 unreachable, length 41
04:48:24.975518 IP 192.168.0.9 > 192.168.0.10: ICMP 192.168.0.9 udp port 5000 unreachable, length 41
04:48:24.983541 IP 192.168.0.10.5000 > 192.168.0.16.5000: UDP, length 5
04:48:25.831762 IP 192.168.0.16.5000 > 192.168.0.9.5000: UDP, length 5
04:48:25.844191 IP 192.168.0.16.5000 > 192.168.0.10.5000: UDP, length 5
04:48:25.846061 IP 192.168.0.9 > 192.168.0.16: ICMP 192.168.0.9 udp port 5000 unreachable, length 41
04:48:25.852345 IP 192.168.0.10 > 192.168.0.16: ICMP 192.168.0.10 udp port 5000 unreachable, length 41
04:48:25.995328 IP 192.168.0.10.5000 > 192.168.0.9.5000: UDP, length 5
04:48:25.996350 IP 192.168.0.16 > 192.168.0.10: ICMP 192.168.0.16 udp port 5000 unreachable, length 41
04:48:26.002390 IP 192.168.0.9 > 192.168.0.10: ICMP 192.168.0.9 udp port 5000 unreachable, length 41
04:48:26.003959 IP 192.168.0.10.5000 > 192.168.0.16.5000: UDP, length 5
04:48:26.230864 IP 192.168.0.10 > 192.168.0.9: ICMP 192.168.0.10 udp port 5000 unreachable, length 41
04:48:26.236701 IP 192.168.0.16 > 192.168.0.9: ICMP 192.168.0.16 udp port 5000 unreachable, length 41
04:48:26.236713 IP 192.168.0.9.5000 > 192.168.0.10.5000: UDP, length 5
04:48:26.250669 IP 192.168.0.9.5000 > 192.168.0.16.5000: UDP, length 5
04:48:27.261058 IP 192.168.0.10 > 192.168.0.9: ICMP 192.168.0.10 udp port 5000 unreachable, length 41
04:48:27.262530 IP 192.168.0.16 > 192.168.0.9: ICMP 192.168.0.16 udp port 5000 unreachable, length 41
04:48:27.267580 IP 192.168.0.9.5000 > 192.168.0.10.5000: UDP, length 5
04:48:27.276440 IP 192.168.0.9.5000 > 192.168.0.16.5000: UDP, length 5
04:48:27.860273 IP 192.168.0.16.5000 > 192.168.0.9.5000: UDP, length 5
04:48:27.874734 IP 192.168.0.9 > 192.168.0.16: ICMP 192.168.0.9 udp port 5000 unreachable, length 41
04:48:27.875045 IP 192.168.0.16.5000 > 192.168.0.10.5000: UDP, length 5
04:48:27.883184 IP 192.168.0.10 > 192.168.0.16: ICMP 192.168.0.10 udp port 5000 unreachable, length 41
04:48:28.019622 IP 192.168.0.10.5000 > 192.168.0.9.5000: UDP, length 5
04:48:28.020619 IP 192.168.0.16 > 192.168.0.10: ICMP 192.168.0.16 udp port 5000 unreachable, length 41
04:48:28.025675 IP 192.168.0.9 > 192.168.0.10: ICMP 192.168.0.9 udp port 5000 unreachable, length 41
04:48:28.027930 IP 192.168.0.10.5000 > 192.168.0.16.5000: UDP, length 5
04:48:29.207844 ARP, Request who-has 192.168.0.9 tell 192.168.0.10, length 28
04:48:29.213801 ARP, Reply 192.168.0.9 is-at 08:00:27:b6:f4:04, length 28
04:48:29.291780 IP 192.168.0.10 > 192.168.0.9: ICMP 192.168.0.10 udp port 5000 unreachable, length 41
04:48:29.296794 IP 192.168.0.16 > 192.168.0.9: ICMP 192.168.0.16 udp port 5000 unreachable, length 41
04:48:29.297241 IP 192.168.0.9.5000 > 192.168.0.10.5000: UDP, length 5
04:48:29.310332 IP 192.168.0.9.5000 > 192.168.0.16.5000: UDP, length 5
04:48:29.983861 ARP, Reply 192.168.0.16 is-at 08:00:27:26:85:17, length 28
04:48:29.991822 ARP, Request who-has 192.168.0.16 tell 192.168.0.10, length 28
04:48:30.321236 IP 192.168.0.10 > 192.168.0.9: ICMP 192.168.0.10 udp port 5000 unreachable, length 41
